
Found 22 Python modules in flask

======================================================================
PASS 1: Collecting function signatures from 10 modules...
======================================================================

[1/10] Scanning __init__.py... Generate CFG for __main__
✓ (1 functions)
[2/10] Scanning __main__.py... Generate CFG for __main__
✓ (0 functions)
[3/10] Scanning app.py... Generate CFG for __main__
✓ (78 functions)
[4/10] Scanning blueprints.py... Generate CFG for __main__
✓ (28 functions)
[5/10] Scanning cli.py... Generate CFG for __main__
✓ (31 functions)
[6/10] Scanning config.py... Generate CFG for __main__
✓ (12 functions)
[7/10] Scanning ctx.py... Generate CFG for __main__
✓ (26 functions)
[8/10] Scanning debughelpers.py... Generate CFG for __main__
✓ (6 functions)
[9/10] Scanning globals.py... Generate CFG for __main__
✓ (6 functions)
[10/10] Scanning helpers.py... Generate CFG for __main__
✓ (21 functions)

======================================================================
PASS 1 COMPLETE: Collected 198 unique functions
======================================================================

DEBUG: Sample of collected functions:
    1. __main__.__getattr__
    2. __main__.iscoroutinefunction
    3. __main__._make_timedelta
    4. __main__.Flask.session_cookie_name
    5. __main__.Flask.send_file_max_age_default
    6. __main__.Flask.use_x_sendfile
    7. __main__.Flask.json_encoder
    8. __main__.Flask.json_decoder
    9. __main__.Flask.__init__
   10. __main__.Flask._check_setup_finished
   11. __main__.Flask.name
   12. __main__.Flask.propagate_exceptions
   13. __main__.Flask.logger
   14. __main__.Flask.jinja_env
   15. __main__.Flask.got_first_request
   16. __main__.Flask.make_config
   17. __main__.Flask.make_aborter
   18. __main__.Flask.auto_find_instance_path
   19. __main__.Flask.open_instance_resource
   20. __main__.Flask.templates_auto_reload
  ... and 178 more

Function breakdown:
  Module-level functions: 0
  Class methods: 198
  Total: 198
======================================================================


======================================================================
PASS 2: Analyzing flask
Total modules to analyze: 10
Configuration: k=2, obj_depth=2
Two-pass mode: ENABLED (cross-module resolution)
======================================================================

[1/10] Analyzing __init__.py... Generate CFG for __main__

============================================================
DEBUG: Module __init__
============================================================
IR module type: <class 'pythonstan.ir.ir_statements.IRModule'>
IR module name: __main__
IR module qualname: __main__
Subscopes found: 1
Module-level functions found: 1
Classes found: 0
Class methods found: 0
Total functions (with methods): 1
  Function 1: __getattr__ (__main__.__getattr__)
  Found cfg for __getattr__

Starting pointer analysis with 1 functions...
Planned analysis for 1 functions
Planned module-level analysis

  DEBUG: Function table injection (AFTER planning):
    Unified table size: 198 functions
    Before injection: 1 local functions
    Unified functions with CFG: 198/198
    After injection: 199 functions (+198 from other modules)
    Sample functions: ['__getattr__', '__main__.__getattr__', '__main__.iscoroutinefunction', '__main__._make_timedelta', '__main__.Flask.session_cookie_name', '__main__.Flask.send_file_max_age_default', '__main__.Flask.use_x_sendfile', '__main__.Flask.json_encoder']
Added class test.py:80:4:class with bases ['oldcls']
Functions with events: 199/199
Total events extracted: 2268
Initialized analysis with 1 contexts
Initial worklist size: constraints=1534, calls=487
Added call edge: [] --[test.py:351:51:call#0]--> [test.py:351:51:call#0]:__main__._make_timedelta
Added call edge: [] --[test.py:831:28:call#0]--> [test.py:831:28:call#0]:__main__.get_debug_flag
Added call edge: [] --[test.py:1880:4:call#0]--> [test.py:1880:4:call#0]:__main__.iscoroutinefunction
Added call edge: [] --[test.py:2249:8:call#0]--> [test.py:2249:8:call#0]:__main__._split_blueprint_path
Added call edge: [] --[test.py:234:4:call#0]--> [test.py:234:4:call#0]:__main__.find_best_app
Added call edge: [] --[test.py:913:12:call#0]--> [test.py:913:12:call#0]:__main__.get_debug_flag
Added call edge: [] --[test.py:877:0:call#0]--> [test.py:877:0:call#0]:__main__.show_server_banner
Added call edge: [] --[test.py:626:8:call#0]--> [test.py:626:8:call#0]:__main__.load_dotenv
Added call edge: [] --[test.py:612:4:call#0]--> [test.py:612:4:call#0]:__main__.get_load_dotenv
Added call edge: [] --[test.py:122:4:call#0]--> [test.py:122:4:call#0]:__main__._dump_loader_info
Added call edge: [] --[test.py:424:0:call#0]--> [test.py:424:0:call#0]:__main__._prepare_send_file_kwargs
Added call edge: [] --[test.py:552:0:call#0]--> [test.py:552:0:call#0]:__main__._prepare_send_file_kwargs
Added call edge: [] --[test.py:702:4:call#0]--> [test.py:702:4:call#0]:__main__._split_blueprint_path
Added call edge: [test.py:2249:8:call#0] --[test.py:702:4:call#0]--> [test.py:2249:8:call#0 → test.py:702:4:call#0]:__main__._split_blueprint_path
Added call edge: [test.py:702:4:call#0] --[test.py:702:4:call#0]--> [test.py:702:4:call#0 → test.py:702:4:call#0]:__main__._split_blueprint_path
Added call edge: [test.py:2249:8:call#0 → test.py:702:4:call#0] --[test.py:702:4:call#0]--> [test.py:702:4:call#0 → test.py:702:4:call#0]:__main__._split_blueprint_path
Added call edge: [test.py:702:4:call#0 → test.py:702:4:call#0] --[test.py:702:4:call#0]--> [test.py:702:4:call#0 → test.py:702:4:call#0]:__main__._split_blueprint_path
Analysis converged after 15 iterations
Statistics: {'objects_created': 139, 'constraints_processed': 25200, 'calls_processed': 530}

============================================================
ANALYSIS RESULTS DEBUG
============================================================
Analysis complete: True
Functions registered: 199
  Function names: ['__getattr__', '__main__.__getattr__', '__main__.iscoroutinefunction', '__main__._make_timedelta', '__main__.Flask.session_cookie_name']
Env entries: 501
  Sample env keys: [(CallStringContext(call_sites=(), k=2), '$tmp_158'), (CallStringContext(call_sites=(), k=2), '$const_30'), (CallStringContext(call_sites=(), k=2), '$tmp_164')]
Heap entries: 64
  Sample heap keys: [(AbstractObject(alloc_id='test.py:2245:8:alloc', alloc_ctx=CallStringContext(call_sites=(), k=2), recv_ctx_fingerprint=None), FieldKey(kind='elem', name=None)), (AbstractObject(alloc_id='test.py:2303:8:alloc', alloc_ctx=CallStringContext(call_sites=(), k=2), recv_ctx_fingerprint=None), FieldKey(kind='elem', name=None)), (AbstractObject(alloc_id='test.py:2338:46:alloc', alloc_ctx=CallStringContext(call_sites=(), k=2), recv_ctx_fingerprint=None), FieldKey(kind='elem', name=None))]
Contexts: 16
Statistics: {'objects_created': 139, 'constraints_processed': 25200, 'calls_processed': 530}
Call graph stats: {'total_cs_edges': 17, 'unique_call_sites': 17, 'unique_functions': 10, 'contexts_with_calls': 5, 'registered_functions': 1}
Class hierarchy bases: 1
Class hierarchy MRO cache: 0

Unresolved calls: 37 unique callees
Top unresolved callees:
   1. chain (4 call sites)
   2. is_running_from_reloader (3 call sites)
   3. _endpoint_from_view_func (2 call sites)
   4. update_wrapper (2 call sites)
   5. $tmp_167 (1 call sites)
   6. Lock (1 call sites)
   7. create_logger (1 call sites)
   8. find_package (1 call sites)
   9. DispatchingJinjaLoader (1 call sites)
  10. processor (1 call sites)
  11. asgiref_async_to_sync (1 call sites)
  12. _wz_redirect (1 call sites)
  13. handler (1 call sites)
  14. $tmp_1043 (1 call sites)
  15. url_func (1 call sites)
  16. $tmp_1074 (1 call sites)
  17. $tmp_1054 (1 call sites)
  18. $tmp_1113 (1 call sites)
  19. $tmp_1132 (1 call sites)
  20. AppContext (1 call sites)
  ... and 17 more

Method reference tracking:
  Total method refs tracked: 471
  Method refs successfully resolved: 309
  Resolution rate: 65.6%
============================================================

✓ (7.41s, 1 funcs)
[2/10] Analyzing __main__.py... Generate CFG for __main__

============================================================
DEBUG: Module __main__
============================================================
IR module type: <class 'pythonstan.ir.ir_statements.IRModule'>
IR module name: __main__
IR module qualname: __main__
Subscopes found: 0
Module-level functions found: 0
Classes found: 0
Class methods found: 0
Total functions (with methods): 0

Starting pointer analysis with 0 functions...
WARNING: No functions with IR, trying module directly
Planned analysis for 1 functions
Planned module-level analysis

  DEBUG: Function table injection (AFTER planning):
    Unified table size: 198 functions
    Before injection: 1 local functions
    Unified functions with CFG: 198/198
    After injection: 199 functions (+198 from other modules)
    Sample functions: ['__main__', '__main__.__getattr__', '__main__.iscoroutinefunction', '__main__._make_timedelta', '__main__.Flask.session_cookie_name', '__main__.Flask.send_file_max_age_default', '__main__.Flask.use_x_sendfile', '__main__.Flask.json_encoder']
Added class test.py:80:4:class with bases ['oldcls']
Functions with events: 198/199
Total events extracted: 2263
Initialized analysis with 1 contexts
Initial worklist size: constraints=1531, calls=486
Added call edge: [] --[test.py:351:51:call#0]--> [test.py:351:51:call#0]:__main__._make_timedelta
Added call edge: [] --[test.py:831:28:call#0]--> [test.py:831:28:call#0]:__main__.get_debug_flag
Added call edge: [] --[test.py:1880:4:call#0]--> [test.py:1880:4:call#0]:__main__.iscoroutinefunction
Added call edge: [] --[test.py:2249:8:call#0]--> [test.py:2249:8:call#0]:__main__._split_blueprint_path
Added call edge: [] --[test.py:234:4:call#0]--> [test.py:234:4:call#0]:__main__.find_best_app
Added call edge: [] --[test.py:913:12:call#0]--> [test.py:913:12:call#0]:__main__.get_debug_flag
Added call edge: [] --[test.py:877:0:call#0]--> [test.py:877:0:call#0]:__main__.show_server_banner
Added call edge: [] --[test.py:626:8:call#0]--> [test.py:626:8:call#0]:__main__.load_dotenv
Added call edge: [] --[test.py:612:4:call#0]--> [test.py:612:4:call#0]:__main__.get_load_dotenv
Added call edge: [] --[test.py:122:4:call#0]--> [test.py:122:4:call#0]:__main__._dump_loader_info
Added call edge: [] --[test.py:424:0:call#0]--> [test.py:424:0:call#0]:__main__._prepare_send_file_kwargs
Added call edge: [] --[test.py:552:0:call#0]--> [test.py:552:0:call#0]:__main__._prepare_send_file_kwargs
Added call edge: [] --[test.py:702:4:call#0]--> [test.py:702:4:call#0]:__main__._split_blueprint_path
Added call edge: [test.py:2249:8:call#0] --[test.py:702:4:call#0]--> [test.py:2249:8:call#0 → test.py:702:4:call#0]:__main__._split_blueprint_path
Added call edge: [test.py:702:4:call#0] --[test.py:702:4:call#0]--> [test.py:702:4:call#0 → test.py:702:4:call#0]:__main__._split_blueprint_path
Added call edge: [test.py:2249:8:call#0 → test.py:702:4:call#0] --[test.py:702:4:call#0]--> [test.py:702:4:call#0 → test.py:702:4:call#0]:__main__._split_blueprint_path
Added call edge: [test.py:702:4:call#0 → test.py:702:4:call#0] --[test.py:702:4:call#0]--> [test.py:702:4:call#0 → test.py:702:4:call#0]:__main__._split_blueprint_path
Analysis converged after 15 iterations
Statistics: {'objects_created': 139, 'constraints_processed': 25155, 'calls_processed': 529}

============================================================
ANALYSIS RESULTS DEBUG
============================================================
Analysis complete: True
Functions registered: 199
  Function names: ['__main__', '__main__.__getattr__', '__main__.iscoroutinefunction', '__main__._make_timedelta', '__main__.Flask.session_cookie_name']
Env entries: 501
  Sample env keys: [(CallStringContext(call_sites=(), k=2), '$tmp_158'), (CallStringContext(call_sites=(), k=2), '$const_30'), (CallStringContext(call_sites=(), k=2), '$tmp_164')]
Heap entries: 64
  Sample heap keys: [(AbstractObject(alloc_id='test.py:2245:8:alloc', alloc_ctx=CallStringContext(call_sites=(), k=2), recv_ctx_fingerprint=None), FieldKey(kind='elem', name=None)), (AbstractObject(alloc_id='test.py:2303:8:alloc', alloc_ctx=CallStringContext(call_sites=(), k=2), recv_ctx_fingerprint=None), FieldKey(kind='elem', name=None)), (AbstractObject(alloc_id='test.py:2338:46:alloc', alloc_ctx=CallStringContext(call_sites=(), k=2), recv_ctx_fingerprint=None), FieldKey(kind='elem', name=None))]
Contexts: 16
Statistics: {'objects_created': 139, 'constraints_processed': 25155, 'calls_processed': 529}
Call graph stats: {'total_cs_edges': 17, 'unique_call_sites': 17, 'unique_functions': 10, 'contexts_with_calls': 5, 'registered_functions': 1}
Class hierarchy bases: 1
Class hierarchy MRO cache: 0

Unresolved calls: 37 unique callees
Top unresolved callees:
   1. chain (4 call sites)
   2. is_running_from_reloader (3 call sites)
   3. _endpoint_from_view_func (2 call sites)
   4. update_wrapper (2 call sites)
   5. $tmp_167 (1 call sites)
   6. Lock (1 call sites)
   7. create_logger (1 call sites)
   8. find_package (1 call sites)
   9. DispatchingJinjaLoader (1 call sites)
  10. processor (1 call sites)
  11. asgiref_async_to_sync (1 call sites)
  12. _wz_redirect (1 call sites)
  13. handler (1 call sites)
  14. $tmp_1043 (1 call sites)
  15. url_func (1 call sites)
  16. $tmp_1074 (1 call sites)
  17. $tmp_1054 (1 call sites)
  18. $tmp_1113 (1 call sites)
  19. $tmp_1132 (1 call sites)
  20. AppContext (1 call sites)
  ... and 17 more

Method reference tracking:
  Total method refs tracked: 471
  Method refs successfully resolved: 308
  Resolution rate: 65.4%
============================================================

✓ (7.32s, 0 funcs)
[3/10] Analyzing app.py... Generate CFG for __main__

============================================================
DEBUG: Module app
============================================================
IR module type: <class 'pythonstan.ir.ir_statements.IRModule'>
IR module name: __main__
IR module qualname: __main__
Subscopes found: 3
Module-level functions found: 2
Classes found: 1
Class methods found: 76
Total functions (with methods): 78
  Function 1: iscoroutinefunction (__main__.iscoroutinefunction)
  Function 2: _make_timedelta (__main__._make_timedelta)
  Class 1: Flask (__main__.Flask)
    Method 1: session_cookie_name (__main__.Flask.session_cookie_name)
    Method 2: session_cookie_name (__main__.Flask.session_cookie_name)
    ... and 74 more methods
  Found cfg for iscoroutinefunction
  Found cfg for _make_timedelta
  Found cfg for session_cookie_name
  Found cfg for session_cookie_name
  Found cfg for send_file_max_age_default
  Found cfg for send_file_max_age_default
  Found cfg for use_x_sendfile
  Found cfg for use_x_sendfile
  Found cfg for json_encoder
  Found cfg for json_encoder
  Found cfg for json_decoder
  Found cfg for json_decoder
  Found cfg for __init__
  Found cfg for _check_setup_finished
  Found cfg for name
  Found cfg for propagate_exceptions
  Found cfg for logger
  Found cfg for jinja_env
  Found cfg for got_first_request
  Found cfg for make_config
  Found cfg for make_aborter
  Found cfg for auto_find_instance_path
  Found cfg for open_instance_resource
  Found cfg for templates_auto_reload
  Found cfg for templates_auto_reload
  Found cfg for create_jinja_environment
  Found cfg for create_global_jinja_loader
  Found cfg for select_jinja_autoescape
  Found cfg for update_template_context
  Found cfg for make_shell_context
  Found cfg for env
  Found cfg for env
  Found cfg for debug
  Found cfg for debug
  Found cfg for run
  Found cfg for test_client
  Found cfg for test_cli_runner
  Found cfg for register_blueprint
  Found cfg for iter_blueprints
  Found cfg for add_url_rule
  Found cfg for template_filter
  Found cfg for add_template_filter
  Found cfg for template_test
  Found cfg for add_template_test
  Found cfg for template_global
  Found cfg for add_template_global
  Found cfg for before_first_request
  Found cfg for teardown_appcontext
  Found cfg for shell_context_processor
  Found cfg for _find_error_handler
  Found cfg for handle_http_exception
  Found cfg for trap_http_exception
  Found cfg for handle_user_exception
  Found cfg for handle_exception
  Found cfg for log_exception
  Found cfg for raise_routing_exception
  Found cfg for dispatch_request
  Found cfg for full_dispatch_request
  Found cfg for finalize_request
  Found cfg for make_default_options_response
  Found cfg for should_ignore_error
  Found cfg for ensure_sync
  Found cfg for async_to_sync
  Found cfg for url_for
  Found cfg for redirect
  Found cfg for make_response
  Found cfg for create_url_adapter
  Found cfg for inject_url_defaults
  Found cfg for handle_url_build_error
  Found cfg for preprocess_request
  Found cfg for process_response
  Found cfg for do_teardown_request
  Found cfg for do_teardown_appcontext
  Found cfg for app_context
  Found cfg for request_context
  Found cfg for test_request_context
  Found cfg for wsgi_app
  Found cfg for __call__

Starting pointer analysis with 78 functions...
Planned analysis for 70 functions
Planned module-level analysis
Planned 1 classes for analysis

  DEBUG: Function table injection (AFTER planning):
    Unified table size: 198 functions
    Before injection: 70 local functions
    Unified functions with CFG: 198/198
    After injection: 268 functions (+198 from other modules)
    Sample functions: ['iscoroutinefunction', '_make_timedelta', 'session_cookie_name', 'send_file_max_age_default', 'use_x_sendfile', 'json_encoder', 'json_decoder', '__init__']
Added class test.py:110:0:class with bases ['Scaffold']
Added 1 class allocation events
Added class test.py:80:4:class with bases ['oldcls']
Functions with events: 268/268
Total events extracted: 3057
Initialized analysis with 1 contexts
Initial worklist size: constraints=1531, calls=486
Added call edge: [] --[test.py:351:51:call#0]--> [test.py:351:51:call#0]:_make_timedelta
Added call edge: [] --[test.py:831:28:call#0]--> [test.py:831:28:call#0]:__main__.get_debug_flag
Added call edge: [] --[test.py:1880:4:call#0]--> [test.py:1880:4:call#0]:iscoroutinefunction
Added call edge: [] --[test.py:2249:8:call#0]--> [test.py:2249:8:call#0]:__main__._split_blueprint_path
Added call edge: [] --[test.py:234:4:call#0]--> [test.py:234:4:call#0]:__main__.find_best_app
Added call edge: [] --[test.py:913:12:call#0]--> [test.py:913:12:call#0]:__main__.get_debug_flag
Added call edge: [] --[test.py:877:0:call#0]--> [test.py:877:0:call#0]:__main__.show_server_banner
Added call edge: [] --[test.py:626:8:call#0]--> [test.py:626:8:call#0]:__main__.load_dotenv
Added call edge: [] --[test.py:612:4:call#0]--> [test.py:612:4:call#0]:__main__.get_load_dotenv
Added call edge: [] --[test.py:122:4:call#0]--> [test.py:122:4:call#0]:__main__._dump_loader_info
Added call edge: [] --[test.py:424:0:call#0]--> [test.py:424:0:call#0]:__main__._prepare_send_file_kwargs
Added call edge: [] --[test.py:552:0:call#0]--> [test.py:552:0:call#0]:__main__._prepare_send_file_kwargs
Added call edge: [] --[test.py:702:4:call#0]--> [test.py:702:4:call#0]:__main__._split_blueprint_path
Added call edge: [test.py:2249:8:call#0] --[test.py:702:4:call#0]--> [test.py:2249:8:call#0 → test.py:702:4:call#0]:__main__._split_blueprint_path
Added call edge: [test.py:702:4:call#0] --[test.py:702:4:call#0]--> [test.py:702:4:call#0 → test.py:702:4:call#0]:__main__._split_blueprint_path
Added call edge: [test.py:2249:8:call#0 → test.py:702:4:call#0] --[test.py:702:4:call#0]--> [test.py:702:4:call#0 → test.py:702:4:call#0]:__main__._split_blueprint_path
Added call edge: [test.py:702:4:call#0 → test.py:702:4:call#0] --[test.py:702:4:call#0]--> [test.py:702:4:call#0 → test.py:702:4:call#0]:__main__._split_blueprint_path
Analysis converged after 15 iterations
Statistics: {'objects_created': 258, 'constraints_processed': 25155, 'calls_processed': 529}

============================================================
ANALYSIS RESULTS DEBUG
============================================================
Analysis complete: True
Functions registered: 268
  Function names: ['iscoroutinefunction', '_make_timedelta', 'session_cookie_name', 'send_file_max_age_default', 'use_x_sendfile']
Env entries: 502
  Sample env keys: [(CallStringContext(call_sites=(), k=2), 'Flask'), (CallStringContext(call_sites=(), k=2), '$tmp_143'), (CallStringContext(call_sites=(), k=2), '$tmp_145')]
Heap entries: 140
  Sample heap keys: [(AbstractObject(alloc_id='test.py:110:0:class', alloc_ctx=CallStringContext(call_sites=(), k=2), recv_ctx_fingerprint=None), FieldKey(kind='attr', name='session_cookie_name')), (AbstractObject(alloc_id='test.py:110:0:class', alloc_ctx=CallStringContext(call_sites=(), k=2), recv_ctx_fingerprint=None), FieldKey(kind='attr', name='send_file_max_age_default')), (AbstractObject(alloc_id='test.py:110:0:class', alloc_ctx=CallStringContext(call_sites=(), k=2), recv_ctx_fingerprint=None), FieldKey(kind='attr', name='use_x_sendfile'))]
Contexts: 16
Statistics: {'objects_created': 258, 'constraints_processed': 25155, 'calls_processed': 529}
Call graph stats: {'total_cs_edges': 17, 'unique_call_sites': 17, 'unique_functions': 10, 'contexts_with_calls': 5, 'registered_functions': 70}
Class hierarchy bases: 2
Class hierarchy MRO cache: 0

Unresolved calls: 37 unique callees
Top unresolved callees:
   1. chain (4 call sites)
   2. is_running_from_reloader (3 call sites)
   3. _endpoint_from_view_func (2 call sites)
   4. update_wrapper (2 call sites)
   5. Lock (1 call sites)
   6. $tmp_167 (1 call sites)
   7. create_logger (1 call sites)
   8. find_package (1 call sites)
   9. DispatchingJinjaLoader (1 call sites)
  10. processor (1 call sites)
  11. asgiref_async_to_sync (1 call sites)
  12. _wz_redirect (1 call sites)
  13. handler (1 call sites)
  14. $tmp_1043 (1 call sites)
  15. url_func (1 call sites)
  16. $tmp_1054 (1 call sites)
  17. $tmp_1074 (1 call sites)
  18. $tmp_1113 (1 call sites)
  19. $tmp_1132 (1 call sites)
  20. AppContext (1 call sites)
  ... and 17 more

Method reference tracking:
  Total method refs tracked: 471
  Method refs successfully resolved: 308
  Resolution rate: 65.4%
============================================================

✓ (8.29s, 78 funcs)
[4/10] Analyzing blueprints.py... Generate CFG for __main__

============================================================
DEBUG: Module blueprints
============================================================
IR module type: <class 'pythonstan.ir.ir_statements.IRModule'>
IR module name: __main__
IR module qualname: __main__
Subscopes found: 2
Module-level functions found: 0
Classes found: 2
Class methods found: 28
Total functions (with methods): 28
  Class 1: BlueprintSetupState (__main__.BlueprintSetupState)
    Method 1: __init__ (__main__.BlueprintSetupState.__init__)
    Method 2: add_url_rule (__main__.BlueprintSetupState.add_url_rule)
  Class 2: Blueprint (__main__.Blueprint)
    Method 1: __init__ (__main__.BlueprintSetupState.__init__)
    Method 2: add_url_rule (__main__.BlueprintSetupState.add_url_rule)
    ... and 26 more methods
  Found cfg for __init__
  Found cfg for add_url_rule
  Found cfg for json_encoder
  Found cfg for json_encoder
  Found cfg for json_decoder
  Found cfg for json_decoder
  Found cfg for __init__
  Found cfg for _check_setup_finished
  Found cfg for record
  Found cfg for record_once
  Found cfg for make_setup_state
  Found cfg for register_blueprint
  Found cfg for register
  Found cfg for add_url_rule
  Found cfg for app_template_filter
  Found cfg for add_app_template_filter
  Found cfg for app_template_test
  Found cfg for add_app_template_test
  Found cfg for app_template_global
  Found cfg for add_app_template_global
  Found cfg for before_app_request
  Found cfg for before_app_first_request
  Found cfg for after_app_request
  Found cfg for teardown_app_request
  Found cfg for app_context_processor
  Found cfg for app_errorhandler
  Found cfg for app_url_value_preprocessor
  Found cfg for app_url_defaults

Starting pointer analysis with 28 functions...
Planned analysis for 24 functions
Planned module-level analysis
Planned 2 classes for analysis

  DEBUG: Function table injection (AFTER planning):
    Unified table size: 198 functions
    Before injection: 24 local functions
    Unified functions with CFG: 198/198
    After injection: 222 functions (+198 from other modules)
    Sample functions: ['__init__', 'add_url_rule', 'json_encoder', 'json_decoder', '_check_setup_finished', 'record', 'record_once', 'make_setup_state']
Added class test.py:36:0:class with bases []
Added class test.py:121:0:class with bases ['Scaffold']
Added 2 class allocation events
Added class test.py:80:4:class with bases ['oldcls']
Functions with events: 222/222
Total events extracted: 2383
Initialized analysis with 1 contexts
Initial worklist size: constraints=1531, calls=486
Added call edge: [] --[test.py:351:51:call#0]--> [test.py:351:51:call#0]:__main__._make_timedelta
Added call edge: [] --[test.py:831:28:call#0]--> [test.py:831:28:call#0]:__main__.get_debug_flag
Added call edge: [] --[test.py:1880:4:call#0]--> [test.py:1880:4:call#0]:__main__.iscoroutinefunction
Added call edge: [] --[test.py:2249:8:call#0]--> [test.py:2249:8:call#0]:__main__._split_blueprint_path
Added call edge: [] --[test.py:234:4:call#0]--> [test.py:234:4:call#0]:__main__.find_best_app
Added call edge: [] --[test.py:913:12:call#0]--> [test.py:913:12:call#0]:__main__.get_debug_flag
Added call edge: [] --[test.py:877:0:call#0]--> [test.py:877:0:call#0]:__main__.show_server_banner
Added call edge: [] --[test.py:626:8:call#0]--> [test.py:626:8:call#0]:__main__.load_dotenv
Added call edge: [] --[test.py:612:4:call#0]--> [test.py:612:4:call#0]:__main__.get_load_dotenv
Added call edge: [] --[test.py:122:4:call#0]--> [test.py:122:4:call#0]:__main__._dump_loader_info
Added call edge: [] --[test.py:424:0:call#0]--> [test.py:424:0:call#0]:__main__._prepare_send_file_kwargs
Added call edge: [] --[test.py:552:0:call#0]--> [test.py:552:0:call#0]:__main__._prepare_send_file_kwargs
Added call edge: [] --[test.py:702:4:call#0]--> [test.py:702:4:call#0]:__main__._split_blueprint_path
Added call edge: [test.py:2249:8:call#0] --[test.py:702:4:call#0]--> [test.py:2249:8:call#0 → test.py:702:4:call#0]:__main__._split_blueprint_path
Added call edge: [test.py:702:4:call#0] --[test.py:702:4:call#0]--> [test.py:702:4:call#0 → test.py:702:4:call#0]:__main__._split_blueprint_path
Added call edge: [test.py:2249:8:call#0 → test.py:702:4:call#0] --[test.py:702:4:call#0]--> [test.py:702:4:call#0 → test.py:702:4:call#0]:__main__._split_blueprint_path
Added call edge: [test.py:702:4:call#0 → test.py:702:4:call#0] --[test.py:702:4:call#0]--> [test.py:702:4:call#0 → test.py:702:4:call#0]:__main__._split_blueprint_path
Analysis converged after 15 iterations
Statistics: {'objects_created': 186, 'constraints_processed': 25155, 'calls_processed': 529}

============================================================
ANALYSIS RESULTS DEBUG
============================================================
Analysis complete: True
Functions registered: 222
  Function names: ['__init__', 'add_url_rule', 'json_encoder', 'json_decoder', '_check_setup_finished']
Env entries: 503
  Sample env keys: [(CallStringContext(call_sites=(), k=2), 'BlueprintSetupState'), (CallStringContext(call_sites=(), k=2), 'Blueprint'), (CallStringContext(call_sites=(), k=2), 'wrapper')]
Heap entries: 90
  Sample heap keys: [(AbstractObject(alloc_id='test.py:36:0:class', alloc_ctx=CallStringContext(call_sites=(), k=2), recv_ctx_fingerprint=None), FieldKey(kind='attr', name='__init__')), (AbstractObject(alloc_id='test.py:36:0:class', alloc_ctx=CallStringContext(call_sites=(), k=2), recv_ctx_fingerprint=None), FieldKey(kind='attr', name='add_url_rule')), (AbstractObject(alloc_id='test.py:121:0:class', alloc_ctx=CallStringContext(call_sites=(), k=2), recv_ctx_fingerprint=None), FieldKey(kind='attr', name='__init__'))]
Contexts: 16
Statistics: {'objects_created': 186, 'constraints_processed': 25155, 'calls_processed': 529}
Call graph stats: {'total_cs_edges': 17, 'unique_call_sites': 17, 'unique_functions': 10, 'contexts_with_calls': 5, 'registered_functions': 24}
Class hierarchy bases: 3
Class hierarchy MRO cache: 0

Unresolved calls: 37 unique callees
Top unresolved callees:
   1. chain (4 call sites)
   2. is_running_from_reloader (3 call sites)
   3. update_wrapper (2 call sites)
   4. _endpoint_from_view_func (2 call sites)
   5. BlueprintSetupState (1 call sites)
   6. $tmp_167 (1 call sites)
   7. Lock (1 call sites)
   8. create_logger (1 call sites)
   9. find_package (1 call sites)
  10. DispatchingJinjaLoader (1 call sites)
  11. processor (1 call sites)
  12. asgiref_async_to_sync (1 call sites)
  13. _wz_redirect (1 call sites)
  14. handler (1 call sites)
  15. $tmp_1043 (1 call sites)
  16. url_func (1 call sites)
  17. $tmp_1074 (1 call sites)
  18. $tmp_1054 (1 call sites)
  19. $tmp_1113 (1 call sites)
  20. $tmp_1132 (1 call sites)
  ... and 17 more

Method reference tracking:
  Total method refs tracked: 471
  Method refs successfully resolved: 308
  Resolution rate: 65.4%
============================================================

✓ (7.60s, 28 funcs)
[5/10] Analyzing cli.py... Generate CFG for __main__

============================================================
DEBUG: Module cli
============================================================
IR module type: <class 'pythonstan.ir.ir_statements.IRModule'>
IR module name: __main__
IR module qualname: __main__
Subscopes found: 24
Module-level functions found: 18
Classes found: 6
Class methods found: 13
Total functions (with methods): 31
  Function 1: find_best_app (__main__.find_best_app)
  Function 2: _called_with_wrong_args (__main__._called_with_wrong_args)
  Function 3: find_app_by_string (__main__.find_app_by_string)
  ... and 15 more module functions
  Class 1: NoAppException (__main__.NoAppException)
  Class 2: ScriptInfo (__main__.ScriptInfo)
    Method 1: __init__ (__main__.ScriptInfo.__init__)
    Method 2: load_app (__main__.ScriptInfo.load_app)
  Class 3: AppGroup (__main__.AppGroup)
    Method 1: command (__main__.AppGroup.command)
    Method 2: group (__main__.AppGroup.group)
  ... and 3 more classes
  Found cfg for find_best_app
  Found cfg for _called_with_wrong_args
  Found cfg for find_app_by_string
  Found cfg for prepare_import
  Found cfg for locate_app
  Found cfg for get_version
  Found cfg for with_appcontext
  Found cfg for _set_app
  Found cfg for _set_debug
  Found cfg for _env_file_callback
  Found cfg for _path_is_ancestor
  Found cfg for load_dotenv
  Found cfg for show_server_banner
  Found cfg for _validate_key
  Found cfg for run_command
  Found cfg for shell_command
  Found cfg for routes_command
  Found cfg for main
  Found cfg for __init__
  Found cfg for load_app
  Found cfg for command
  Found cfg for group
  Found cfg for __init__
  Found cfg for _load_plugin_commands
  Found cfg for get_command
  Found cfg for list_commands
  Found cfg for make_context
  Found cfg for parse_args
  Found cfg for __init__
  Found cfg for convert
  Found cfg for convert

Starting pointer analysis with 31 functions...
Planned analysis for 28 functions
Planned module-level analysis
Planned 6 classes for analysis

  DEBUG: Function table injection (AFTER planning):
    Unified table size: 198 functions
    Before injection: 28 local functions
    Unified functions with CFG: 198/198
    After injection: 226 functions (+198 from other modules)
    Sample functions: ['find_best_app', '_called_with_wrong_args', 'find_app_by_string', 'prepare_import', 'locate_app', 'get_version', 'with_appcontext', '_set_app']
Added class test.py:28:0:class with bases ['click.UsageError']
Added class test.py:266:0:class with bases []
Added class test.py:362:0:class with bases ['click.Group']
Added class test.py:481:0:class with bases ['test.py:362:0:class']
Added class test.py:729:0:class with bases ['click.ParamType']
Added class test.py:812:0:class with bases ['click.Path']
Added 6 class allocation events
Added class test.py:80:4:class with bases ['oldcls']
Functions with events: 226/226
Total events extracted: 2662
Initialized analysis with 1 contexts
Initial worklist size: constraints=1531, calls=486
Added call edge: [] --[test.py:234:4:call#0]--> [test.py:234:4:call#0]:find_best_app
Added call edge: [] --[test.py:913:12:call#0]--> [test.py:913:12:call#0]:__main__.get_debug_flag
Added call edge: [] --[test.py:877:0:call#0]--> [test.py:877:0:call#0]:show_server_banner
Added call edge: [] --[test.py:612:4:call#0]--> [test.py:612:4:call#0]:__main__.get_load_dotenv
Added call edge: [] --[test.py:626:8:call#0]--> [test.py:626:8:call#0]:load_dotenv
Added call edge: [] --[test.py:351:51:call#0]--> [test.py:351:51:call#0]:__main__._make_timedelta
Added call edge: [] --[test.py:831:28:call#0]--> [test.py:831:28:call#0]:__main__.get_debug_flag
Added call edge: [] --[test.py:1880:4:call#0]--> [test.py:1880:4:call#0]:__main__.iscoroutinefunction
Added call edge: [] --[test.py:2249:8:call#0]--> [test.py:2249:8:call#0]:__main__._split_blueprint_path
Added call edge: [] --[test.py:122:4:call#0]--> [test.py:122:4:call#0]:__main__._dump_loader_info
Added call edge: [] --[test.py:424:0:call#0]--> [test.py:424:0:call#0]:__main__._prepare_send_file_kwargs
Added call edge: [] --[test.py:552:0:call#0]--> [test.py:552:0:call#0]:__main__._prepare_send_file_kwargs
Added call edge: [] --[test.py:702:4:call#0]--> [test.py:702:4:call#0]:__main__._split_blueprint_path
Added call edge: [test.py:2249:8:call#0] --[test.py:702:4:call#0]--> [test.py:2249:8:call#0 → test.py:702:4:call#0]:__main__._split_blueprint_path
Added call edge: [test.py:702:4:call#0] --[test.py:702:4:call#0]--> [test.py:702:4:call#0 → test.py:702:4:call#0]:__main__._split_blueprint_path
Added call edge: [test.py:2249:8:call#0 → test.py:702:4:call#0] --[test.py:702:4:call#0]--> [test.py:702:4:call#0 → test.py:702:4:call#0]:__main__._split_blueprint_path
Added call edge: [test.py:702:4:call#0 → test.py:702:4:call#0] --[test.py:702:4:call#0]--> [test.py:702:4:call#0 → test.py:702:4:call#0]:__main__._split_blueprint_path
Analysis converged after 14 iterations
Statistics: {'objects_created': 179, 'constraints_processed': 23478, 'calls_processed': 529}

============================================================
ANALYSIS RESULTS DEBUG
============================================================
Analysis complete: True
Functions registered: 226
  Function names: ['find_best_app', '_called_with_wrong_args', 'find_app_by_string', 'prepare_import', 'locate_app']
Env entries: 507
  Sample env keys: [(CallStringContext(call_sites=(), k=2), 'NoAppException'), (CallStringContext(call_sites=(), k=2), 'ScriptInfo'), (CallStringContext(call_sites=(), k=2), 'AppGroup')]
Heap entries: 78
  Sample heap keys: [(AbstractObject(alloc_id='test.py:266:0:class', alloc_ctx=CallStringContext(call_sites=(), k=2), recv_ctx_fingerprint=None), FieldKey(kind='attr', name='__init__')), (AbstractObject(alloc_id='test.py:266:0:class', alloc_ctx=CallStringContext(call_sites=(), k=2), recv_ctx_fingerprint=None), FieldKey(kind='attr', name='load_app')), (AbstractObject(alloc_id='test.py:362:0:class', alloc_ctx=CallStringContext(call_sites=(), k=2), recv_ctx_fingerprint=None), FieldKey(kind='attr', name='command'))]
Contexts: 16
Statistics: {'objects_created': 179, 'constraints_processed': 23478, 'calls_processed': 529}
Call graph stats: {'total_cs_edges': 17, 'unique_call_sites': 17, 'unique_functions': 10, 'contexts_with_calls': 5, 'registered_functions': 28}
Class hierarchy bases: 7
Class hierarchy MRO cache: 0

Unresolved calls: 37 unique callees
Top unresolved callees:
   1. chain (4 call sites)
   2. is_running_from_reloader (3 call sites)
   3. update_wrapper (2 call sites)
   4. _endpoint_from_view_func (2 call sites)
   5. attr (1 call sites)
   6. __import__ (1 call sites)
   7. run_simple (1 call sites)
   8. Completer (1 call sites)
   9. interactive_hook (1 call sites)
  10. ScriptInfo (1 call sites)
  11. $tmp_167 (1 call sites)
  12. Lock (1 call sites)
  13. create_logger (1 call sites)
  14. find_package (1 call sites)
  15. DispatchingJinjaLoader (1 call sites)
  16. processor (1 call sites)
  17. asgiref_async_to_sync (1 call sites)
  18. _wz_redirect (1 call sites)
  19. handler (1 call sites)
  20. $tmp_1043 (1 call sites)
  ... and 17 more

Method reference tracking:
  Total method refs tracked: 471
  Method refs successfully resolved: 308
  Resolution rate: 65.4%
============================================================

✓ (7.64s, 31 funcs)
[6/10] Analyzing config.py... Generate CFG for __main__

============================================================
DEBUG: Module config
============================================================
IR module type: <class 'pythonstan.ir.ir_statements.IRModule'>
IR module name: __main__
IR module qualname: __main__
Subscopes found: 2
Module-level functions found: 0
Classes found: 2
Class methods found: 12
Total functions (with methods): 12
  Class 1: ConfigAttribute (__main__.ConfigAttribute)
    Method 1: __init__ (__main__.ConfigAttribute.__init__)
    Method 2: __get__ (__main__.ConfigAttribute.__get__)
    ... and 1 more methods
  Class 2: Config (__main__.Config)
    Method 1: __init__ (__main__.ConfigAttribute.__init__)
    Method 2: __get__ (__main__.ConfigAttribute.__get__)
    ... and 10 more methods
  Found cfg for __init__
  Found cfg for __get__
  Found cfg for __set__
  Found cfg for __init__
  Found cfg for from_envvar
  Found cfg for from_prefixed_env
  Found cfg for from_pyfile
  Found cfg for from_object
  Found cfg for from_file
  Found cfg for from_mapping
  Found cfg for get_namespace
  Found cfg for __repr__

Starting pointer analysis with 12 functions...
Planned analysis for 11 functions
Planned module-level analysis
Planned 2 classes for analysis

  DEBUG: Function table injection (AFTER planning):
    Unified table size: 198 functions
    Before injection: 11 local functions
    Unified functions with CFG: 198/198
    After injection: 209 functions (+198 from other modules)
    Sample functions: ['__init__', '__get__', '__set__', 'from_envvar', 'from_prefixed_env', 'from_pyfile', 'from_object', 'from_file']
Added class test.py:10:0:class with bases []
Added class test.py:29:0:class with bases ['dict']
Added 2 class allocation events
Added class test.py:80:4:class with bases ['oldcls']
Functions with events: 209/209
Total events extracted: 2387
Initialized analysis with 1 contexts
Initial worklist size: constraints=1531, calls=486
Added call edge: [] --[test.py:351:51:call#0]--> [test.py:351:51:call#0]:__main__._make_timedelta
Added call edge: [] --[test.py:831:28:call#0]--> [test.py:831:28:call#0]:__main__.get_debug_flag
Added call edge: [] --[test.py:1880:4:call#0]--> [test.py:1880:4:call#0]:__main__.iscoroutinefunction
Added call edge: [] --[test.py:2249:8:call#0]--> [test.py:2249:8:call#0]:__main__._split_blueprint_path
Added call edge: [] --[test.py:234:4:call#0]--> [test.py:234:4:call#0]:__main__.find_best_app
Added call edge: [] --[test.py:913:12:call#0]--> [test.py:913:12:call#0]:__main__.get_debug_flag
Added call edge: [] --[test.py:877:0:call#0]--> [test.py:877:0:call#0]:__main__.show_server_banner
Added call edge: [] --[test.py:626:8:call#0]--> [test.py:626:8:call#0]:__main__.load_dotenv
Added call edge: [] --[test.py:612:4:call#0]--> [test.py:612:4:call#0]:__main__.get_load_dotenv
Added call edge: [] --[test.py:122:4:call#0]--> [test.py:122:4:call#0]:__main__._dump_loader_info
Added call edge: [] --[test.py:424:0:call#0]--> [test.py:424:0:call#0]:__main__._prepare_send_file_kwargs
Added call edge: [] --[test.py:552:0:call#0]--> [test.py:552:0:call#0]:__main__._prepare_send_file_kwargs
Added call edge: [] --[test.py:702:4:call#0]--> [test.py:702:4:call#0]:__main__._split_blueprint_path
Added call edge: [test.py:2249:8:call#0] --[test.py:702:4:call#0]--> [test.py:2249:8:call#0 → test.py:702:4:call#0]:__main__._split_blueprint_path
Added call edge: [test.py:702:4:call#0] --[test.py:702:4:call#0]--> [test.py:702:4:call#0 → test.py:702:4:call#0]:__main__._split_blueprint_path
Added call edge: [test.py:2249:8:call#0 → test.py:702:4:call#0] --[test.py:702:4:call#0]--> [test.py:702:4:call#0 → test.py:702:4:call#0]:__main__._split_blueprint_path
Added call edge: [test.py:702:4:call#0 → test.py:702:4:call#0] --[test.py:702:4:call#0]--> [test.py:702:4:call#0 → test.py:702:4:call#0]:__main__._split_blueprint_path
Analysis converged after 15 iterations
Statistics: {'objects_created': 161, 'constraints_processed': 25155, 'calls_processed': 529}

============================================================
ANALYSIS RESULTS DEBUG
============================================================
Analysis complete: True
Functions registered: 209
  Function names: ['__init__', '__get__', '__set__', 'from_envvar', 'from_prefixed_env']
Env entries: 503
  Sample env keys: [(CallStringContext(call_sites=(), k=2), 'ConfigAttribute'), (CallStringContext(call_sites=(), k=2), 'Config'), (CallStringContext(call_sites=(), k=2), '$tmp_20')]
Heap entries: 78
  Sample heap keys: [(AbstractObject(alloc_id='test.py:10:0:class', alloc_ctx=CallStringContext(call_sites=(), k=2), recv_ctx_fingerprint=None), FieldKey(kind='attr', name='__init__')), (AbstractObject(alloc_id='test.py:10:0:class', alloc_ctx=CallStringContext(call_sites=(), k=2), recv_ctx_fingerprint=None), FieldKey(kind='attr', name='__get__')), (AbstractObject(alloc_id='test.py:10:0:class', alloc_ctx=CallStringContext(call_sites=(), k=2), recv_ctx_fingerprint=None), FieldKey(kind='attr', name='__set__'))]
Contexts: 16
Statistics: {'objects_created': 161, 'constraints_processed': 25155, 'calls_processed': 529}
Call graph stats: {'total_cs_edges': 17, 'unique_call_sites': 17, 'unique_functions': 10, 'contexts_with_calls': 5, 'registered_functions': 11}
Class hierarchy bases: 3
Class hierarchy MRO cache: 0

Unresolved calls: 37 unique callees
Top unresolved callees:
   1. chain (4 call sites)
   2. is_running_from_reloader (3 call sites)
   3. _endpoint_from_view_func (2 call sites)
   4. update_wrapper (2 call sites)
   5. dir (1 call sites)
   6. import_string (1 call sites)
   7. $tmp_167 (1 call sites)
   8. Lock (1 call sites)
   9. create_logger (1 call sites)
  10. find_package (1 call sites)
  11. DispatchingJinjaLoader (1 call sites)
  12. processor (1 call sites)
  13. asgiref_async_to_sync (1 call sites)
  14. _wz_redirect (1 call sites)
  15. handler (1 call sites)
  16. $tmp_1043 (1 call sites)
  17. url_func (1 call sites)
  18. $tmp_1074 (1 call sites)
  19. $tmp_1054 (1 call sites)
  20. $tmp_1113 (1 call sites)
  ... and 17 more

Method reference tracking:
  Total method refs tracked: 471
  Method refs successfully resolved: 308
  Resolution rate: 65.4%
============================================================

✓ (7.28s, 12 funcs)
[7/10] Analyzing ctx.py... Generate CFG for __main__

============================================================
DEBUG: Module ctx
============================================================
IR module type: <class 'pythonstan.ir.ir_statements.IRModule'>
IR module name: __main__
IR module qualname: __main__
Subscopes found: 7
Module-level functions found: 4
Classes found: 3
Class methods found: 22
Total functions (with methods): 26
  Function 1: after_this_request (__main__.after_this_request)
  Function 2: copy_current_request_context (__main__.copy_current_request_context)
  Function 3: has_request_context (__main__.has_request_context)
  ... and 1 more module functions
  Class 1: _AppCtxGlobals (__main__._AppCtxGlobals)
    Method 1: __getattr__ (__main__._AppCtxGlobals.__getattr__)
    Method 2: __setattr__ (__main__._AppCtxGlobals.__setattr__)
    ... and 7 more methods
  Class 2: AppContext (__main__.AppContext)
    Method 1: __init__ (__main__.AppContext.__init__)
    Method 2: push (__main__.AppContext.push)
    ... and 3 more methods
  Class 3: RequestContext (__main__.RequestContext)
    Method 1: __init__ (__main__.RequestContext.__init__)
    Method 2: copy (__main__.RequestContext.copy)
    ... and 6 more methods
  Found cfg for after_this_request
  Found cfg for copy_current_request_context
  Found cfg for has_request_context
  Found cfg for has_app_context
  Found cfg for __getattr__
  Found cfg for __setattr__
  Found cfg for __delattr__
  Found cfg for get
  Found cfg for pop
  Found cfg for setdefault
  Found cfg for __contains__
  Found cfg for __iter__
  Found cfg for __repr__
  Found cfg for __init__
  Found cfg for push
  Found cfg for pop
  Found cfg for __enter__
  Found cfg for __exit__
  Found cfg for __init__
  Found cfg for copy
  Found cfg for match_request
  Found cfg for push
  Found cfg for pop
  Found cfg for __enter__
  Found cfg for __exit__
  Found cfg for __repr__

Starting pointer analysis with 26 functions...
Planned analysis for 19 functions
Planned module-level analysis
Planned 3 classes for analysis

  DEBUG: Function table injection (AFTER planning):
    Unified table size: 198 functions
    Before injection: 19 local functions
    Unified functions with CFG: 198/198
    After injection: 217 functions (+198 from other modules)
    Sample functions: ['after_this_request', 'copy_current_request_context', 'has_request_context', 'has_app_context', '__getattr__', '__setattr__', '__delattr__', 'get']
Added class test.py:25:0:class with bases []
Added class test.py:229:0:class with bases []
Added class test.py:278:0:class with bases []
Added 3 class allocation events
Added class test.py:80:4:class with bases ['oldcls']
Functions with events: 217/217
Total events extracted: 2467
Initialized analysis with 1 contexts
Initial worklist size: constraints=1531, calls=486
Added call edge: [] --[test.py:351:51:call#0]--> [test.py:351:51:call#0]:__main__._make_timedelta
Added call edge: [] --[test.py:831:28:call#0]--> [test.py:831:28:call#0]:__main__.get_debug_flag
Added call edge: [] --[test.py:1880:4:call#0]--> [test.py:1880:4:call#0]:__main__.iscoroutinefunction
Added call edge: [] --[test.py:2249:8:call#0]--> [test.py:2249:8:call#0]:__main__._split_blueprint_path
Added call edge: [] --[test.py:234:4:call#0]--> [test.py:234:4:call#0]:__main__.find_best_app
Added call edge: [] --[test.py:913:12:call#0]--> [test.py:913:12:call#0]:__main__.get_debug_flag
Added call edge: [] --[test.py:877:0:call#0]--> [test.py:877:0:call#0]:__main__.show_server_banner
Added call edge: [] --[test.py:626:8:call#0]--> [test.py:626:8:call#0]:__main__.load_dotenv
Added call edge: [] --[test.py:612:4:call#0]--> [test.py:612:4:call#0]:__main__.get_load_dotenv
Added call edge: [] --[test.py:122:4:call#0]--> [test.py:122:4:call#0]:__main__._dump_loader_info
Added call edge: [] --[test.py:424:0:call#0]--> [test.py:424:0:call#0]:__main__._prepare_send_file_kwargs
Added call edge: [] --[test.py:552:0:call#0]--> [test.py:552:0:call#0]:__main__._prepare_send_file_kwargs
Added call edge: [] --[test.py:702:4:call#0]--> [test.py:702:4:call#0]:__main__._split_blueprint_path
Added call edge: [test.py:2249:8:call#0] --[test.py:702:4:call#0]--> [test.py:2249:8:call#0 → test.py:702:4:call#0]:__main__._split_blueprint_path
Added call edge: [test.py:702:4:call#0] --[test.py:702:4:call#0]--> [test.py:702:4:call#0 → test.py:702:4:call#0]:__main__._split_blueprint_path
Added call edge: [test.py:2249:8:call#0 → test.py:702:4:call#0] --[test.py:702:4:call#0]--> [test.py:702:4:call#0 → test.py:702:4:call#0]:__main__._split_blueprint_path
Added call edge: [test.py:702:4:call#0 → test.py:702:4:call#0] --[test.py:702:4:call#0]--> [test.py:702:4:call#0 → test.py:702:4:call#0]:__main__._split_blueprint_path
Analysis converged after 16 iterations
Statistics: {'objects_created': 172, 'constraints_processed': 26832, 'calls_processed': 529}

============================================================
ANALYSIS RESULTS DEBUG
============================================================
Analysis complete: True
Functions registered: 217
  Function names: ['after_this_request', 'copy_current_request_context', 'has_request_context', 'has_app_context', '__getattr__']
Env entries: 504
  Sample env keys: [(CallStringContext(call_sites=(), k=2), '_AppCtxGlobals'), (CallStringContext(call_sites=(), k=2), 'AppContext'), (CallStringContext(call_sites=(), k=2), 'RequestContext')]
Heap entries: 86
  Sample heap keys: [(AbstractObject(alloc_id='test.py:25:0:class', alloc_ctx=CallStringContext(call_sites=(), k=2), recv_ctx_fingerprint=None), FieldKey(kind='attr', name='__getattr__')), (AbstractObject(alloc_id='test.py:25:0:class', alloc_ctx=CallStringContext(call_sites=(), k=2), recv_ctx_fingerprint=None), FieldKey(kind='attr', name='__setattr__')), (AbstractObject(alloc_id='test.py:25:0:class', alloc_ctx=CallStringContext(call_sites=(), k=2), recv_ctx_fingerprint=None), FieldKey(kind='attr', name='__delattr__'))]
Contexts: 16
Statistics: {'objects_created': 172, 'constraints_processed': 26832, 'calls_processed': 529}
Call graph stats: {'total_cs_edges': 17, 'unique_call_sites': 17, 'unique_functions': 10, 'contexts_with_calls': 5, 'registered_functions': 19}
Class hierarchy bases: 4
Class hierarchy MRO cache: 0

Unresolved calls: 37 unique callees
Top unresolved callees:
   1. chain (4 call sites)
   2. is_running_from_reloader (3 call sites)
   3. _endpoint_from_view_func (2 call sites)
   4. update_wrapper (2 call sites)
   5. request_close (1 call sites)
   6. $tmp_167 (1 call sites)
   7. Lock (1 call sites)
   8. create_logger (1 call sites)
   9. find_package (1 call sites)
  10. DispatchingJinjaLoader (1 call sites)
  11. processor (1 call sites)
  12. asgiref_async_to_sync (1 call sites)
  13. _wz_redirect (1 call sites)
  14. handler (1 call sites)
  15. $tmp_1043 (1 call sites)
  16. url_func (1 call sites)
  17. $tmp_1074 (1 call sites)
  18. $tmp_1054 (1 call sites)
  19. $tmp_1113 (1 call sites)
  20. $tmp_1132 (1 call sites)
  ... and 17 more

Method reference tracking:
  Total method refs tracked: 471
  Method refs successfully resolved: 308
  Resolution rate: 65.4%
============================================================

✓ (7.76s, 26 funcs)
[8/10] Analyzing debughelpers.py... Generate CFG for __main__

============================================================
DEBUG: Module debughelpers
============================================================
IR module type: <class 'pythonstan.ir.ir_statements.IRModule'>
IR module name: __main__
IR module qualname: __main__
Subscopes found: 6
Module-level functions found: 3
Classes found: 3
Class methods found: 3
Total functions (with methods): 6
  Function 1: attach_enctype_error_multidict (__main__.attach_enctype_error_multidict)
  Function 2: _dump_loader_info (__main__._dump_loader_info)
  Function 3: explain_template_loading_attempts (__main__.explain_template_loading_attempts)
  Class 1: UnexpectedUnicodeError (__main__.UnexpectedUnicodeError)
  Class 2: DebugFilesKeyError (__main__.DebugFilesKeyError)
    Method 1: __init__ (__main__.DebugFilesKeyError.__init__)
    Method 2: __str__ (__main__.DebugFilesKeyError.__str__)
  Class 3: FormDataRoutingRedirect (__main__.FormDataRoutingRedirect)
    Method 1: __init__ (__main__.FormDataRoutingRedirect.__init__)
  Found cfg for attach_enctype_error_multidict
  Found cfg for _dump_loader_info
  Found cfg for explain_template_loading_attempts
  Found cfg for __init__
  Found cfg for __str__
  Found cfg for __init__

Starting pointer analysis with 6 functions...
Planned analysis for 5 functions
Planned module-level analysis
Planned 3 classes for analysis

  DEBUG: Function table injection (AFTER planning):
    Unified table size: 198 functions
    Before injection: 5 local functions
    Unified functions with CFG: 198/198
    After injection: 203 functions (+198 from other modules)
    Sample functions: ['attach_enctype_error_multidict', '_dump_loader_info', 'explain_template_loading_attempts', '__init__', '__str__', '__main__.__getattr__', '__main__.iscoroutinefunction', '__main__._make_timedelta']
Added class test.py:8:0:class with bases ['AssertionError', 'UnicodeError']
Added class test.py:14:0:class with bases ['KeyError', 'AssertionError']
Added class test.py:41:0:class with bases ['AssertionError']
Added 3 class allocation events
Added class test.py:80:4:class with bases ['oldcls']
Added class test.py:80:4:class with bases ['oldcls']
Functions with events: 203/203
Total events extracted: 2384
Initialized analysis with 1 contexts
Initial worklist size: constraints=1531, calls=486
Added call edge: [] --[test.py:122:4:call#0]--> [test.py:122:4:call#0]:_dump_loader_info
Added call edge: [] --[test.py:351:51:call#0]--> [test.py:351:51:call#0]:__main__._make_timedelta
Added call edge: [] --[test.py:831:28:call#0]--> [test.py:831:28:call#0]:__main__.get_debug_flag
Added call edge: [] --[test.py:1880:4:call#0]--> [test.py:1880:4:call#0]:__main__.iscoroutinefunction
Added call edge: [] --[test.py:2249:8:call#0]--> [test.py:2249:8:call#0]:__main__._split_blueprint_path
Added call edge: [] --[test.py:234:4:call#0]--> [test.py:234:4:call#0]:__main__.find_best_app
Added call edge: [] --[test.py:913:12:call#0]--> [test.py:913:12:call#0]:__main__.get_debug_flag
Added call edge: [] --[test.py:877:0:call#0]--> [test.py:877:0:call#0]:__main__.show_server_banner
Added call edge: [] --[test.py:626:8:call#0]--> [test.py:626:8:call#0]:__main__.load_dotenv
Added call edge: [] --[test.py:612:4:call#0]--> [test.py:612:4:call#0]:__main__.get_load_dotenv
Added call edge: [] --[test.py:424:0:call#0]--> [test.py:424:0:call#0]:__main__._prepare_send_file_kwargs
Added call edge: [] --[test.py:552:0:call#0]--> [test.py:552:0:call#0]:__main__._prepare_send_file_kwargs
Added call edge: [] --[test.py:702:4:call#0]--> [test.py:702:4:call#0]:__main__._split_blueprint_path
Added call edge: [test.py:2249:8:call#0] --[test.py:702:4:call#0]--> [test.py:2249:8:call#0 → test.py:702:4:call#0]:__main__._split_blueprint_path
Added call edge: [test.py:702:4:call#0] --[test.py:702:4:call#0]--> [test.py:702:4:call#0 → test.py:702:4:call#0]:__main__._split_blueprint_path
Added call edge: [test.py:2249:8:call#0 → test.py:702:4:call#0] --[test.py:702:4:call#0]--> [test.py:702:4:call#0 → test.py:702:4:call#0]:__main__._split_blueprint_path
Added call edge: [test.py:702:4:call#0 → test.py:702:4:call#0] --[test.py:702:4:call#0]--> [test.py:702:4:call#0 → test.py:702:4:call#0]:__main__._split_blueprint_path
Analysis converged after 13 iterations
Statistics: {'objects_created': 156, 'constraints_processed': 21801, 'calls_processed': 529}

============================================================
ANALYSIS RESULTS DEBUG
============================================================
Analysis complete: True
Functions registered: 203
  Function names: ['attach_enctype_error_multidict', '_dump_loader_info', 'explain_template_loading_attempts', '__init__', '__str__']
Env entries: 504
  Sample env keys: [(CallStringContext(call_sites=(), k=2), 'UnexpectedUnicodeError'), (CallStringContext(call_sites=(), k=2), 'DebugFilesKeyError'), (CallStringContext(call_sites=(), k=2), 'FormDataRoutingRedirect')]
Heap entries: 67
  Sample heap keys: [(AbstractObject(alloc_id='test.py:14:0:class', alloc_ctx=CallStringContext(call_sites=(), k=2), recv_ctx_fingerprint=None), FieldKey(kind='attr', name='__init__')), (AbstractObject(alloc_id='test.py:14:0:class', alloc_ctx=CallStringContext(call_sites=(), k=2), recv_ctx_fingerprint=None), FieldKey(kind='attr', name='__str__')), (AbstractObject(alloc_id='test.py:41:0:class', alloc_ctx=CallStringContext(call_sites=(), k=2), recv_ctx_fingerprint=None), FieldKey(kind='attr', name='__init__'))]
Contexts: 16
Statistics: {'objects_created': 156, 'constraints_processed': 21801, 'calls_processed': 529}
Call graph stats: {'total_cs_edges': 17, 'unique_call_sites': 17, 'unique_functions': 10, 'contexts_with_calls': 5, 'registered_functions': 5}
Class hierarchy bases: 4
Class hierarchy MRO cache: 0

Unresolved calls: 37 unique callees
Top unresolved callees:
   1. chain (4 call sites)
   2. is_running_from_reloader (3 call sites)
   3. _endpoint_from_view_func (2 call sites)
   4. update_wrapper (2 call sites)
   5. $tmp_167 (1 call sites)
   6. Lock (1 call sites)
   7. create_logger (1 call sites)
   8. find_package (1 call sites)
   9. DispatchingJinjaLoader (1 call sites)
  10. processor (1 call sites)
  11. asgiref_async_to_sync (1 call sites)
  12. _wz_redirect (1 call sites)
  13. handler (1 call sites)
  14. $tmp_1043 (1 call sites)
  15. url_func (1 call sites)
  16. $tmp_1074 (1 call sites)
  17. $tmp_1054 (1 call sites)
  18. $tmp_1113 (1 call sites)
  19. $tmp_1132 (1 call sites)
  20. AppContext (1 call sites)
  ... and 17 more

Method reference tracking:
  Total method refs tracked: 471
  Method refs successfully resolved: 308
  Resolution rate: 65.4%
============================================================

✓ (6.16s, 6 funcs)
[9/10] Analyzing globals.py... Generate CFG for __main__

============================================================
DEBUG: Module globals
============================================================
IR module type: <class 'pythonstan.ir.ir_statements.IRModule'>
IR module name: __main__
IR module qualname: __main__
Subscopes found: 2
Module-level functions found: 1
Classes found: 1
Class methods found: 5
Total functions (with methods): 6
  Function 1: __getattr__ (__main__.__getattr__)
  Class 1: _FakeStack (__main__._FakeStack)
    Method 1: __init__ (__main__._FakeStack.__init__)
    Method 2: _warn (__main__._FakeStack._warn)
    ... and 3 more methods
  Found cfg for __getattr__
  Found cfg for __init__
  Found cfg for _warn
  Found cfg for push
  Found cfg for pop
  Found cfg for top

Starting pointer analysis with 6 functions...
Planned analysis for 6 functions
Planned module-level analysis
Planned 1 classes for analysis

  DEBUG: Function table injection (AFTER planning):
    Unified table size: 198 functions
    Before injection: 6 local functions
    Unified functions with CFG: 198/198
    After injection: 204 functions (+198 from other modules)
    Sample functions: ['__getattr__', '__init__', '_warn', 'push', 'pop', 'top', '__main__.__getattr__', '__main__.iscoroutinefunction']
Added class test.py:15:0:class with bases []
Added 1 class allocation events
Added class test.py:80:4:class with bases ['oldcls']
Functions with events: 204/204
Total events extracted: 2302
Initialized analysis with 1 contexts
Initial worklist size: constraints=1531, calls=486
Added call edge: [] --[test.py:351:51:call#0]--> [test.py:351:51:call#0]:__main__._make_timedelta
Added call edge: [] --[test.py:831:28:call#0]--> [test.py:831:28:call#0]:__main__.get_debug_flag
Added call edge: [] --[test.py:1880:4:call#0]--> [test.py:1880:4:call#0]:__main__.iscoroutinefunction
Added call edge: [] --[test.py:2249:8:call#0]--> [test.py:2249:8:call#0]:__main__._split_blueprint_path
Added call edge: [] --[test.py:234:4:call#0]--> [test.py:234:4:call#0]:__main__.find_best_app
Added call edge: [] --[test.py:913:12:call#0]--> [test.py:913:12:call#0]:__main__.get_debug_flag
Added call edge: [] --[test.py:877:0:call#0]--> [test.py:877:0:call#0]:__main__.show_server_banner
Added call edge: [] --[test.py:626:8:call#0]--> [test.py:626:8:call#0]:__main__.load_dotenv
Added call edge: [] --[test.py:612:4:call#0]--> [test.py:612:4:call#0]:__main__.get_load_dotenv
Added call edge: [] --[test.py:122:4:call#0]--> [test.py:122:4:call#0]:__main__._dump_loader_info
Added call edge: [] --[test.py:424:0:call#0]--> [test.py:424:0:call#0]:__main__._prepare_send_file_kwargs
Added call edge: [] --[test.py:552:0:call#0]--> [test.py:552:0:call#0]:__main__._prepare_send_file_kwargs
Added call edge: [] --[test.py:702:4:call#0]--> [test.py:702:4:call#0]:__main__._split_blueprint_path
Added call edge: [test.py:2249:8:call#0] --[test.py:702:4:call#0]--> [test.py:2249:8:call#0 → test.py:702:4:call#0]:__main__._split_blueprint_path
Added call edge: [test.py:702:4:call#0] --[test.py:702:4:call#0]--> [test.py:702:4:call#0 → test.py:702:4:call#0]:__main__._split_blueprint_path
Added call edge: [test.py:2249:8:call#0 → test.py:702:4:call#0] --[test.py:702:4:call#0]--> [test.py:702:4:call#0 → test.py:702:4:call#0]:__main__._split_blueprint_path
Added call edge: [test.py:702:4:call#0 → test.py:702:4:call#0] --[test.py:702:4:call#0]--> [test.py:702:4:call#0 → test.py:702:4:call#0]:__main__._split_blueprint_path
Analysis converged after 15 iterations
Statistics: {'objects_created': 145, 'constraints_processed': 25155, 'calls_processed': 529}

============================================================
ANALYSIS RESULTS DEBUG
============================================================
Analysis complete: True
Functions registered: 204
  Function names: ['__getattr__', '__init__', '_warn', 'push', 'pop']
Env entries: 502
  Sample env keys: [(CallStringContext(call_sites=(), k=2), '_FakeStack'), (CallStringContext(call_sites=(), k=2), '$tmp_158'), (CallStringContext(call_sites=(), k=2), '$const_30')]
Heap entries: 69
  Sample heap keys: [(AbstractObject(alloc_id='test.py:15:0:class', alloc_ctx=CallStringContext(call_sites=(), k=2), recv_ctx_fingerprint=None), FieldKey(kind='attr', name='__init__')), (AbstractObject(alloc_id='test.py:15:0:class', alloc_ctx=CallStringContext(call_sites=(), k=2), recv_ctx_fingerprint=None), FieldKey(kind='attr', name='_warn')), (AbstractObject(alloc_id='test.py:15:0:class', alloc_ctx=CallStringContext(call_sites=(), k=2), recv_ctx_fingerprint=None), FieldKey(kind='attr', name='push'))]
Contexts: 16
Statistics: {'objects_created': 145, 'constraints_processed': 25155, 'calls_processed': 529}
Call graph stats: {'total_cs_edges': 17, 'unique_call_sites': 17, 'unique_functions': 10, 'contexts_with_calls': 5, 'registered_functions': 6}
Class hierarchy bases: 2
Class hierarchy MRO cache: 0

Unresolved calls: 37 unique callees
Top unresolved callees:
   1. chain (4 call sites)
   2. is_running_from_reloader (3 call sites)
   3. _endpoint_from_view_func (2 call sites)
   4. update_wrapper (2 call sites)
   5. $tmp_167 (1 call sites)
   6. Lock (1 call sites)
   7. create_logger (1 call sites)
   8. find_package (1 call sites)
   9. DispatchingJinjaLoader (1 call sites)
  10. processor (1 call sites)
  11. asgiref_async_to_sync (1 call sites)
  12. _wz_redirect (1 call sites)
  13. handler (1 call sites)
  14. $tmp_1043 (1 call sites)
  15. url_func (1 call sites)
  16. $tmp_1074 (1 call sites)
  17. $tmp_1054 (1 call sites)
  18. $tmp_1113 (1 call sites)
  19. $tmp_1132 (1 call sites)
  20. AppContext (1 call sites)
  ... and 17 more

Method reference tracking:
  Total method refs tracked: 471
  Method refs successfully resolved: 308
  Resolution rate: 65.4%
============================================================

✓ (7.09s, 6 funcs)
[10/10] Analyzing helpers.py... Generate CFG for __main__

============================================================
DEBUG: Module helpers
============================================================
IR module type: <class 'pythonstan.ir.ir_statements.IRModule'>
IR module name: __main__
IR module qualname: __main__
Subscopes found: 18
Module-level functions found: 17
Classes found: 1
Class methods found: 4
Total functions (with methods): 21
  Function 1: get_env (__main__.get_env)
  Function 2: get_debug_flag (__main__.get_debug_flag)
  Function 3: get_load_dotenv (__main__.get_load_dotenv)
  ... and 14 more module functions
  Class 1: locked_cached_property (__main__.locked_cached_property)
    Method 1: __init__ (__main__.locked_cached_property.__init__)
    Method 2: __get__ (__main__.locked_cached_property.__get__)
    ... and 2 more methods
  Found cfg for get_env
  Found cfg for get_debug_flag
  Found cfg for get_load_dotenv
  Found cfg for stream_with_context
  Found cfg for make_response
  Found cfg for url_for
  Found cfg for redirect
  Found cfg for abort
  Found cfg for get_template_attribute
  Found cfg for flash
  Found cfg for get_flashed_messages
  Found cfg for _prepare_send_file_kwargs
  Found cfg for send_file
  Found cfg for send_from_directory
  Found cfg for get_root_path
  Found cfg for is_ip
  Found cfg for _split_blueprint_path
  Found cfg for __init__
  Found cfg for __get__
  Found cfg for __set__
  Found cfg for __delete__

Starting pointer analysis with 21 functions...
Planned analysis for 21 functions
Planned module-level analysis
Planned 1 classes for analysis

  DEBUG: Function table injection (AFTER planning):
    Unified table size: 198 functions
    Before injection: 21 local functions
    Unified functions with CFG: 198/198
    After injection: 219 functions (+198 from other modules)
    Sample functions: ['get_env', 'get_debug_flag', 'get_load_dotenv', 'stream_with_context', 'make_response', 'url_for', 'redirect', 'abort']
Added class test.py:644:0:class with bases ['werkzeug.utils.cached_property']
Added 1 class allocation events
Added class test.py:80:4:class with bases ['oldcls']
Functions with events: 219/219
Total events extracted: 2476
Initialized analysis with 1 contexts
Initial worklist size: constraints=1531, calls=486
Added call edge: [] --[test.py:424:0:call#0]--> [test.py:424:0:call#0]:_prepare_send_file_kwargs
Added call edge: [] --[test.py:552:0:call#0]--> [test.py:552:0:call#0]:_prepare_send_file_kwargs
Added call edge: [] --[test.py:702:4:call#0]--> [test.py:702:4:call#0]:_split_blueprint_path
Added call edge: [] --[test.py:351:51:call#0]--> [test.py:351:51:call#0]:__main__._make_timedelta
Added call edge: [] --[test.py:831:28:call#0]--> [test.py:831:28:call#0]:get_debug_flag
Added call edge: [] --[test.py:1880:4:call#0]--> [test.py:1880:4:call#0]:__main__.iscoroutinefunction
Added call edge: [] --[test.py:2249:8:call#0]--> [test.py:2249:8:call#0]:_split_blueprint_path
Added call edge: [] --[test.py:234:4:call#0]--> [test.py:234:4:call#0]:__main__.find_best_app
Added call edge: [] --[test.py:913:12:call#0]--> [test.py:913:12:call#0]:get_debug_flag
Added call edge: [] --[test.py:877:0:call#0]--> [test.py:877:0:call#0]:__main__.show_server_banner
Added call edge: [] --[test.py:626:8:call#0]--> [test.py:626:8:call#0]:__main__.load_dotenv
Added call edge: [] --[test.py:612:4:call#0]--> [test.py:612:4:call#0]:get_load_dotenv
Added call edge: [] --[test.py:122:4:call#0]--> [test.py:122:4:call#0]:__main__._dump_loader_info
Added call edge: [test.py:702:4:call#0] --[test.py:702:4:call#0]--> [test.py:702:4:call#0 → test.py:702:4:call#0]:_split_blueprint_path
Added call edge: [test.py:2249:8:call#0] --[test.py:702:4:call#0]--> [test.py:2249:8:call#0 → test.py:702:4:call#0]:_split_blueprint_path
Added call edge: [test.py:702:4:call#0 → test.py:702:4:call#0] --[test.py:702:4:call#0]--> [test.py:702:4:call#0 → test.py:702:4:call#0]:_split_blueprint_path
Added call edge: [test.py:2249:8:call#0 → test.py:702:4:call#0] --[test.py:702:4:call#0]--> [test.py:702:4:call#0 → test.py:702:4:call#0]:_split_blueprint_path
Analysis converged after 17 iterations
Statistics: {'objects_created': 155, 'constraints_processed': 28509, 'calls_processed': 529}

============================================================
ANALYSIS RESULTS DEBUG
============================================================
Analysis complete: True
Functions registered: 219
  Function names: ['get_env', 'get_debug_flag', 'get_load_dotenv', 'stream_with_context', 'make_response']
Env entries: 502
  Sample env keys: [(CallStringContext(call_sites=(), k=2), 'locked_cached_property'), (CallStringContext(call_sites=(), k=2), '$const_4'), (CallStringContext(call_sites=(), k=2), 'generator')]
Heap entries: 68
  Sample heap keys: [(AbstractObject(alloc_id='test.py:644:0:class', alloc_ctx=CallStringContext(call_sites=(), k=2), recv_ctx_fingerprint=None), FieldKey(kind='attr', name='__init__')), (AbstractObject(alloc_id='test.py:644:0:class', alloc_ctx=CallStringContext(call_sites=(), k=2), recv_ctx_fingerprint=None), FieldKey(kind='attr', name='__get__')), (AbstractObject(alloc_id='test.py:644:0:class', alloc_ctx=CallStringContext(call_sites=(), k=2), recv_ctx_fingerprint=None), FieldKey(kind='attr', name='__set__'))]
Contexts: 16
Statistics: {'objects_created': 155, 'constraints_processed': 28509, 'calls_processed': 529}
Call graph stats: {'total_cs_edges': 17, 'unique_call_sites': 17, 'unique_functions': 10, 'contexts_with_calls': 5, 'registered_functions': 21}
Class hierarchy bases: 2
Class hierarchy MRO cache: 0

Unresolved calls: 37 unique callees
Top unresolved callees:
   1. chain (4 call sites)
   2. is_running_from_reloader (3 call sites)
   3. _endpoint_from_view_func (2 call sites)
   4. update_wrapper (2 call sites)
   5. generator (1 call sites)
   6. _wz_abort (1 call sites)
   7. RLock (1 call sites)
   8. $tmp_167 (1 call sites)
   9. Lock (1 call sites)
  10. create_logger (1 call sites)
  11. find_package (1 call sites)
  12. DispatchingJinjaLoader (1 call sites)
  13. processor (1 call sites)
  14. asgiref_async_to_sync (1 call sites)
  15. _wz_redirect (1 call sites)
  16. handler (1 call sites)
  17. $tmp_1043 (1 call sites)
  18. url_func (1 call sites)
  19. $tmp_1074 (1 call sites)
  20. $tmp_1054 (1 call sites)
  ... and 17 more

Method reference tracking:
  Total method refs tracked: 471
  Method refs successfully resolved: 308
  Resolution rate: 65.4%
============================================================

✓ (8.55s, 21 funcs)

======================================================================
GENERATING DIAGNOSTIC REPORT
======================================================================

Traceback (most recent call last):
  File "/mnt/data_fast/code/PythonStAn/benchmark/analyze_real_world.py", line 1484, in <module>
    main()
  File "/mnt/data_fast/code/PythonStAn/benchmark/analyze_real_world.py", line 1459, in main
    all_analyses = analyzer.analyze_project_incremental(modules, 
  File "/mnt/data_fast/code/PythonStAn/benchmark/analyze_real_world.py", line 705, in analyze_project_incremental
    diag = analysis.diagnose_unresolved()
  File "/mnt/data_fast/code/PythonStAn/pythonstan/analysis/pointer/kcfa2/analysis.py", line 336, in diagnose_unresolved
    for edge in self._call_graph.get_edges():
AttributeError: 'CallGraphAdapter' object has no attribute 'get_edges'
